Unnamed: 0.3,Unnamed: 0.2,Unnamed: 0.1,Unnamed: 0,claim,text,organization,lang_name,rating_label,rating_value,entity_strings,entities,nr_entities,num_words,probable_lang,Topic,Topic Name,Topic Representation
28693,33978,8299,2061,http://data.gesis.org/claimskg/creative_work/cbead984-477e-5231-ab89-88e0a0ceea7c,A video shared on Facebook purportedly shows President-elect Joe Biden and others not wearing masks or practicing social distancing while celebrating his 78th birthday last week.,checkyourfact,English,False,1,"Facebook, practicing social distancing","['Facebook', ' practicing social distancing']",2.0,26,en,14,14_mask_masks_wear_wearing,"mask, masks, wear, wearing, shows, gretchen, whitmer, pandemic, face, purportedly"
52359,58745,8188,1950,http://data.gesis.org/claimskg/creative_work/b8c37d78-8c64-5476-8d30-2bbc62c4b2f5,An image shared on Facebook purportedly shows Democratic presidential nominee Joe Biden violating social distancing guidelines and not wearing a mask at a recent event.,checkyourfact,English,False,1,"Facebook, Joe Biden, wearing a mask","['Facebook', ' Joe Biden', ' wearing a mask']",3.0,25,en,14,14_mask_masks_wear_wearing,"mask, masks, wear, wearing, shows, gretchen, whitmer, pandemic, face, purportedly"
34405,39739,64778,2749,http://data.gesis.org/claimskg/creative_work/7f7a5bbb-c1ce-5d7d-8a58-4b307b7d16af,A video showed President-elect Joe Biden celebrating his birthday with a maskless group of people in 2020.,snopes,English,False,1,"Joe Biden, President-elect","['Joe Biden', ' President-elect']",2.0,17,en,14,14_mask_masks_wear_wearing,"mask, masks, wear, wearing, shows, gretchen, whitmer, pandemic, face, purportedly"
53091,59479,8938,2700,http://data.gesis.org/claimskg/creative_work/fce037b7-b7e1-5363-a8c6-c485a0cc7cb7,An image shared on Facebook allegedly shows President Joe Biden and former Secretary of State Hillary Clinton forgoing face masks in private during the COVID-19 pandemic.,checkyourfact,English,False,1,"COVID, Facebook, face masks","['COVID', ' Facebook', ' face masks']",3.0,26,en,14,14_mask_masks_wear_wearing,"mask, masks, wear, wearing, shows, gretchen, whitmer, pandemic, face, purportedly"
51181,57560,6736,498,http://data.gesis.org/claimskg/creative_work/a1cade6d-db26-5942-98c3-5f31a05597ba,A post shared on Facebook claims President Joe Biden was the only world leader wearing a mask during a recent video conference.,checkyourfact,English,False,1,"Facebook, President Joe Biden, wearing a mask","['Facebook', ' President Joe Biden', ' wearing a mask']",3.0,22,en,14,14_mask_masks_wear_wearing,"mask, masks, wear, wearing, shows, gretchen, whitmer, pandemic, face, purportedly"
55119,61535,40170,1343,http://data.gesis.org/claimskg/creative_work/3a6026bd-5022-5126-ba29-6478ab3b3d72,Says Joe Biden was the only world leader to wear a face mask during a video conference.,politifact,English,False,1,"Joe Biden, video conference, wear a face mask","['Joe Biden', ' video conference', ' wear a face mask']",3.0,17,en,14,14_mask_masks_wear_wearing,"mask, masks, wear, wearing, shows, gretchen, whitmer, pandemic, face, purportedly"
44160,50206,10894,4656,http://data.gesis.org/claimskg/creative_work/ad68ece7-2f10-52cf-8a44-8cbd626b3692,An image shared on Facebook purportedly shows Democratic presidential nominee Joe Biden not wearing a face mask on an airplane during the COVID-19 pandemic.,checkyourfact,English,False,1,"COVID-19 pandemic, Facebook, Joe Biden","['COVID-19 pandemic', ' Facebook', ' Joe Biden']",3.0,24,en,14,14_mask_masks_wear_wearing,"mask, masks, wear, wearing, shows, gretchen, whitmer, pandemic, face, purportedly"
42651,48576,64595,2566,http://data.gesis.org/claimskg/creative_work/ae5942b9-4ba9-5e68-93de-03d21b277e08,"A photograph captures Joe Biden meeting with several government officials in September 2020, with none of those present wearing masks.",snopes,English,False,1,"Joe Biden, September 2020, wearing masks","['Joe Biden', ' September 2020', ' wearing masks']",3.0,20,en,14,14_mask_masks_wear_wearing,"mask, masks, wear, wearing, shows, gretchen, whitmer, pandemic, face, purportedly"
2338,4423,13518,2170,http://data.gesis.org/claimskg/creative_work/e31c6b41-0da9-5c4f-acb3-fa510cc8f39a,Biden wore a mask during a video call alone in a room,factcheck_afp,English,False,1,,,0.0,12,en,14,14_mask_masks_wear_wearing,"mask, masks, wear, wearing, shows, gretchen, whitmer, pandemic, face, purportedly"
14472,18855,47578,8751,http://data.gesis.org/claimskg/creative_work/d76a54b4-6b91-5ea6-bfb1-5c1c702d84e4,Photo shows Joe Biden doesn’t wear a mask on a plane.,politifact,English,False,1,Joe Biden,['Joe Biden'],1.0,11,en,14,14_mask_masks_wear_wearing,"mask, masks, wear, wearing, shows, gretchen, whitmer, pandemic, face, purportedly"
29376,34666,69769,7740,http://data.gesis.org/claimskg/creative_work/958eeb3f-a3f3-5689-98b9-edc669609853,U.S. President Joe Biden was the only world leader to wear a mask during an online climate summit in April 2021.,snopes,English,False,1,"U.S. President Joe Biden, climate summit","['U.S. President Joe Biden', ' climate summit']",2.0,21,en,14,14_mask_masks_wear_wearing,"mask, masks, wear, wearing, shows, gretchen, whitmer, pandemic, face, purportedly"
41784,47674,42074,3247,http://data.gesis.org/claimskg/creative_work/e4ec7edc-e754-5afe-b649-fde60a927463,"Photo shows Ron DeSantis holding a shirt that says, Your mask is as useless as Joe Biden.",politifact,English,False,1,"Joe Biden, Ron DeSantis","['Joe Biden', ' Ron DeSantis']",2.0,17,en,14,14_mask_masks_wear_wearing,"mask, masks, wear, wearing, shows, gretchen, whitmer, pandemic, face, purportedly"
64060,70952,8132,1894,http://data.gesis.org/claimskg/creative_work/b7132f2b-a5e0-58d7-9e55-80272afc38df,"An image shared on Facebook over 1,900 times purportedly shows Democratic presidential nominee Joe Biden and Michigan Gov. Gretchen Whitmer in Washington, D.C. last night without masks.",checkyourfact,English,False,1,"Democratic, Facebook, Washington, D.C., presidential nominee","['Democratic', ' Facebook', ' Washington', ' D.C.', ' presidential nominee']",5.0,27,en,14,14_mask_masks_wear_wearing,"mask, masks, wear, wearing, shows, gretchen, whitmer, pandemic, face, purportedly"
65786,72791,67827,5798,http://data.gesis.org/claimskg/creative_work/ed1c759f-e598-5213-baef-3d7a79d70704,"An image collage shows former U.S. Vice President Joe Biden and Sen. Kamala Harris without masks in August 2020, suggesting they were flouting public health guidelines during the COVID-19 pandemic.",snopes,English,False,1,"August 2020, COVID, Joe Biden, Kamala Harris, Sen., U.S. Vice President, public health","['August 2020', ' COVID', ' Joe Biden', ' Kamala Harris', ' Sen.', ' U.S. Vice President', ' public health']",7.0,30,en,14,14_mask_masks_wear_wearing,"mask, masks, wear, wearing, shows, gretchen, whitmer, pandemic, face, purportedly"
42768,48704,31612,2465,http://data.gesis.org/claimskg/creative_work/c4b9ea28-ee36-56e6-aba4-4f78147a0f61,Image depicts Joe Biden and Kamala Harris at a campaign event with no masks.,truthorfiction,English,False,1,"Joe Biden, Kamala Harris, campaign event","['Joe Biden', ' Kamala Harris', ' campaign event']",3.0,14,en,14,14_mask_masks_wear_wearing,"mask, masks, wear, wearing, shows, gretchen, whitmer, pandemic, face, purportedly"
56008,62451,43466,4639,http://data.gesis.org/claimskg/creative_work/4d5f9814-b3b1-552d-b5ed-02de2a534c05,Says Joe Biden and Gretchen Whitmer were maskless at the Detroit Athletic Club while OUR children are being mandated to wear a mask while playing outdoor sports.,politifact,English,False,1,"Detroit Athletic Club, Gretchen Whitmer, Joe Biden, outdoor sports","['Detroit Athletic Club', ' Gretchen Whitmer', ' Joe Biden', ' outdoor sports']",4.0,27,en,14,14_mask_masks_wear_wearing,"mask, masks, wear, wearing, shows, gretchen, whitmer, pandemic, face, purportedly"
54179,60575,6331,93,http://data.gesis.org/claimskg/creative_work/7c8c6df7-91f1-5ee5-a6b8-3e3e4af581d7,An image shared on Facebook purportedly shows former Vice President Joe Biden and Michigan Gov. Gretchen Whitmer violating social distancing guidelines on April 9.,checkyourfact,English,False,1,"April 9, Facebook, social distancing guidelines","['April 9', ' Facebook', ' social distancing guidelines']",3.0,24,en,14,14_mask_masks_wear_wearing,"mask, masks, wear, wearing, shows, gretchen, whitmer, pandemic, face, purportedly"
