Unnamed: 0.3,Unnamed: 0.2,Unnamed: 0.1,Unnamed: 0,claim,text,organization,lang_name,rating_label,rating_value,entity_strings,entities,nr_entities,num_words,probable_lang,Topic,Topic Name,Topic Representation
2011,4085,40768,1941,http://data.gesis.org/claimskg/creative_work/9ad12821-8a92-5ed0-a852-f9b883c9c016,Biden admits $5 gas is being done on purpose and this has been his plan all along.,politifact,English,False,1,,,0.0,17,en,1,1_gas_prices_pipeline_oil,"gas, prices, pipeline, oil, keystone, energy, ban, climate, fracking, the"
26323,31589,8832,2594,http://data.gesis.org/claimskg/creative_work/5a468558-525c-55d3-80dc-2f885b8a360f,A post shared on Facebook claims President Joe Biden plans to give every American a $5 gas card.,checkyourfact,English,FALSE,1,"Facebook, President Joe Biden","['Facebook', ' President Joe Biden']",2.0,18,en,1,1_gas_prices_pipeline_oil,"gas, prices, pipeline, oil, keystone, energy, ban, climate, fracking, the"
41943,47838,41427,2600,http://data.gesis.org/claimskg/creative_work/ec0bb7c7-8574-54a8-a873-fee1fdb90390,"A Big Boy restaurant sign said Donald Trump was right when he predicted if Biden was elected, you'd see $5, $6 and $7 gas.",politifact,English,False,1,"Big Boy, Donald Trump","['Big Boy', ' Donald Trump']",2.0,24,en,1,1_gas_prices_pipeline_oil,"gas, prices, pipeline, oil, keystone, energy, ban, climate, fracking, the"
38050,43476,13653,2305,http://data.gesis.org/claimskg/creative_work/48215dc1-ad25-5e9e-a619-3694c4dda343,Biden to blame for higher gasoline prices,factcheck_afp,English,FALSE,1,"Biden, gasoline prices","['Biden', ' gasoline prices']",2.0,7,en,1,1_gas_prices_pipeline_oil,"gas, prices, pipeline, oil, keystone, energy, ban, climate, fracking, the"
42128,48026,41976,3149,http://data.gesis.org/claimskg/creative_work/87f76910-9745-5458-9fa9-1c9b2eec7c20,Joe Biden confirmed his plan to abolish the entire U.S. oil industry.,politifact,English,False,1,"Joe Biden, U.S. oil industry","['Joe Biden', ' U.S. oil industry']",2.0,12,en,1,1_gas_prices_pipeline_oil,"gas, prices, pipeline, oil, keystone, energy, ban, climate, fracking, the"
42996,48953,66972,4943,http://data.gesis.org/claimskg/creative_work/77f1a813-9d9b-5eb3-984c-f9ba1da0aae0,The most common price of U.S. gas was above $5 per gallon when U.S. President Joe Biden took office in January 2021.,snopes,English,False,1,"January 2021, U.S., U.S. President Joe Biden","['January 2021', ' U.S.', ' U.S. President Joe Biden']",3.0,22,en,1,1_gas_prices_pipeline_oil,"gas, prices, pipeline, oil, keystone, energy, ban, climate, fracking, the"
17016,21520,39350,523,http://data.gesis.org/claimskg/creative_work/9a5a2836-9874-5b91-9a80-19584f99e84d,President Biden confirm(ed) everyone will receive their $1k gas checks this week!!,politifact,English,False,1,gas checks,['gas checks'],1.0,12,en,1,1_gas_prices_pipeline_oil,"gas, prices, pipeline, oil, keystone, energy, ban, climate, fracking, the"
