Unnamed: 0.3,Unnamed: 0.2,Unnamed: 0.1,Unnamed: 0,claim,text,organization,lang_name,rating_label,rating_value,entity_strings,entities,nr_entities,num_words,probable_lang,Topic,Topic Name,Topic Representation
27061,32331,50487,2617,http://data.gesis.org/claimskg/creative_work/dd854768-50b8-52d0-a953-d24cbad78df6,The proposal by President Joe Biden would put the U.S. No. 2 in the world for the highest corporate tax rate.,politifact,English,MIXTURE,2,"President Joe Biden, corporate tax","['President Joe Biden', ' corporate tax']",2.0,21,en,8,8_tax_taxes_your_raise,"tax, taxes, your, raise, percent, increase, home, wants, gains, capital"
50644,57020,55247,7377,http://data.gesis.org/claimskg/creative_work/d4f34836-e5ff-5cc7-8e3d-81fc6d5c8a49,President Joe Biden’s corporate tax rate increase would put us in line with other industrial nations.,politifact,English,MIXTURE,2,"President Joe Biden, corporate tax rate, industrial nations","['President Joe Biden', ' corporate tax rate', ' industrial nations']",3.0,16,en,8,8_tax_taxes_your_raise,"tax, taxes, your, raise, percent, increase, home, wants, gains, capital"
45264,51393,42517,3690,http://data.gesis.org/claimskg/creative_work/dba61b72-9c77-5982-bb37-5e0b1b32df8d,Says Joe Biden is proposing a tax increase that’s the largest in American history.,politifact,English,False,1,"American history, Joe Biden, tax increase","['American history', ' Joe Biden', ' tax increase']",3.0,14,en,8,8_tax_taxes_your_raise,"tax, taxes, your, raise, percent, increase, home, wants, gains, capital"
64289,71188,70069,8040,http://data.gesis.org/claimskg/creative_work/64c4e3e0-927f-5b60-aa6d-02137dd9e3df,"During his 2020 presidential campaign, Democratic nominee Joe Biden proposed the largest tax increase in modern U.S. history.",snopes,English,False,1,"Democratic, Joe Biden, U.S. history, presidential campaign, tax increase","['Democratic', ' Joe Biden', ' U.S. history', ' presidential campaign', ' tax increase']",5.0,18,en,8,8_tax_taxes_your_raise,"tax, taxes, your, raise, percent, increase, home, wants, gains, capital"
37219,42626,16573,5225,http://data.gesis.org/claimskg/creative_work/b4c1ebd3-8d01-5b62-8505-b3727a69c48e,Joe Biden will raise taxes on 82 percent of Americans,factcheck_afp,English,FALSE,1,"Joe Biden, raise taxes","['Joe Biden', ' raise taxes']",2.0,10,en,8,8_tax_taxes_your_raise,"tax, taxes, your, raise, percent, increase, home, wants, gains, capital"
21370,26360,17251,5903,http://data.gesis.org/claimskg/creative_work/87fd2efb-dadb-546c-93b5-f3bd7c35bc4c,Joe Biden’s tax proposal will take a 40 percent cut of profits from Americans who sell their home,factcheck_afp,English,MIXTURE,2,Joe Biden,['Joe Biden'],1.0,18,en,8,8_tax_taxes_your_raise,"tax, taxes, your, raise, percent, increase, home, wants, gains, capital"
41725,47614,42412,3585,http://data.gesis.org/claimskg/creative_work/f606c133-28e3-5805-8b06-72a1859ebe32,Joe Biden wants to raise taxes on 82% of all Americans.,politifact,English,False,1,"Joe Biden, raise taxes","['Joe Biden', ' raise taxes']",2.0,11,en,8,8_tax_taxes_your_raise,"tax, taxes, your, raise, percent, increase, home, wants, gains, capital"
