Unnamed: 0.3,Unnamed: 0.2,Unnamed: 0.1,Unnamed: 0,claim,text,organization,lang_name,rating_label,rating_value,entity_strings,entities,nr_entities,num_words,probable_lang,Topic,Topic Name,Topic Representation
40886,46763,43618,4791,http://data.gesis.org/claimskg/creative_work/28581658-09a1-5ec2-959e-bf83201f042f,Biden slipped up and came out saying he’s going to tax your 401k. Are any of you EVEN paying attention?,politifact,English,False,1,"401k, Biden","['401k', ' Biden']",2.0,20,en,8,8_tax_taxes_your_raise,"tax, taxes, your, raise, percent, increase, home, wants, gains, capital"
16980,21484,40198,1371,http://data.gesis.org/claimskg/creative_work/40cf215e-7a87-5fe7-87ae-55982436e7d1,Says Joe Biden repeatedly told Americans he's going to raise their taxes.,politifact,English,False,1,Joe Biden,['Joe Biden'],1.0,12,en,8,8_tax_taxes_your_raise,"tax, taxes, your, raise, percent, increase, home, wants, gains, capital"
57130,63632,49869,1999,http://data.gesis.org/claimskg/creative_work/83c4d4d1-d385-5dcf-869d-d5c8cf73d5e4,Biden wants to end Shareholder Capitalism.. that's your 401k..your pensions.. your retirement.. are you voting for that???,politifact,English,MIXTURE,2,"401k, Biden, Capitalism, Shareholder","['401k', ' Biden', ' Capitalism', ' Shareholder']",4.0,17,en,8,8_tax_taxes_your_raise,"tax, taxes, your, raise, percent, increase, home, wants, gains, capital"
37344,42757,16474,5126,http://data.gesis.org/claimskg/creative_work/a259b8f6-1cf4-5463-9459-dd9b6b27c290,Biden says will raise taxes,factcheck_afp,English,FALSE,1,"Biden, raise taxes","['Biden', ' raise taxes']",2.0,5,en,8,8_tax_taxes_your_raise,"tax, taxes, your, raise, percent, increase, home, wants, gains, capital"
37599,43020,39144,317,http://data.gesis.org/claimskg/creative_work/7e6ef841-efb6-5408-af1e-9343f9d111fa,Says Joe Biden wants to put a 3% annual federal tax on your home.,politifact,English,False,1,"3%, Joe Biden","['3%', ' Joe Biden']",2.0,14,en,8,8_tax_taxes_your_raise,"tax, taxes, your, raise, percent, increase, home, wants, gains, capital"
45264,51393,42517,3690,http://data.gesis.org/claimskg/creative_work/dba61b72-9c77-5982-bb37-5e0b1b32df8d,Says Joe Biden is proposing a tax increase that’s the largest in American history.,politifact,English,False,1,"American history, Joe Biden, tax increase","['American history', ' Joe Biden', ' tax increase']",3.0,14,en,8,8_tax_taxes_your_raise,"tax, taxes, your, raise, percent, increase, home, wants, gains, capital"
